{
  "schemaVersion": 1,
  "corpusId": "t3code-9b2d0431-opencode-9f69463f-pi-0.84.4",
  "generatedFrom": {
    "t3CodeCommit": "9b2d04317c68233782e0630464ac86d77d0686f3",
    "openCodeCommit": "9f69463f1d556af2b5b51d2efa1c04f5f544f911"
  },
  "entries": [
    {
      "id": "OC-CLI-0001",
      "category": "lifecycle",
      "operation": "opencode --version",
      "transport": "process",
      "method": "exec",
      "path": null,
      "support": "required",
      "notes": "Used when T3 owns a local OpenCode process.",
      "sources": [
        {
          "repository": "https://github.com/pingdotgg/t3code.git",
          "path": "apps/server/src/provider/Layers/OpenCodeProvider.ts",
          "line": 394,
          "symbol": "checkOpenCodeProviderStatus"
        }
      ]
    },
    {
      "id": "OC-HTTP-0001",
      "category": "health",
      "operation": "global.health",
      "transport": "http",
      "method": "GET",
      "path": "/global/health",
      "support": "required",
      "sources": [
        {
          "repository": "https://github.com/pingdotgg/t3code.git",
          "path": "apps/server/src/provider/opencodeRuntime.ts",
          "line": 144,
          "symbol": "verifyOpenCodeServerVersion"
        },
        {
          "repository": "https://github.com/anomalyco/opencode.git",
          "path": "packages/sdk/js/src/v2/gen/sdk.gen.ts",
          "line": 1326,
          "symbol": "Global.health"
        }
      ]
    },
    {
      "id": "OC-HTTP-0002",
      "category": "discovery",
      "operation": "provider.list",
      "transport": "http",
      "method": "GET",
      "path": "/provider",
      "support": "required",
      "sources": [
        {
          "repository": "https://github.com/pingdotgg/t3code.git",
          "path": "apps/server/src/provider/opencodeRuntime.ts",
          "line": 837,
          "symbol": "loadProviders"
        },
        {
          "repository": "https://github.com/anomalyco/opencode.git",
          "path": "packages/sdk/js/src/v2/gen/sdk.gen.ts",
          "line": 3320,
          "symbol": "Provider.list"
        }
      ]
    },
    {
      "id": "OC-HTTP-0003",
      "category": "discovery",
      "operation": "app.agents",
      "transport": "http",
      "method": "GET",
      "path": "/agent",
      "support": "required",
      "sources": [
        {
          "repository": "https://github.com/pingdotgg/t3code.git",
          "path": "apps/server/src/provider/opencodeRuntime.ts",
          "line": 853,
          "symbol": "loadAgents"
        },
        {
          "repository": "https://github.com/anomalyco/opencode.git",
          "path": "packages/sdk/js/src/v2/gen/sdk.gen.ts",
          "line": 580,
          "symbol": "App.agents"
        }
      ]
    },
    {
      "id": "OC-HTTP-0004",
      "category": "discovery",
      "operation": "app.skills",
      "transport": "http",
      "method": "GET",
      "path": "/skill",
      "support": "required",
      "sources": [
        {
          "repository": "https://github.com/pingdotgg/t3code.git",
          "path": "apps/server/src/provider/opencodeRuntime.ts",
          "line": 859,
          "symbol": "loadSkills"
        },
        {
          "repository": "https://github.com/anomalyco/opencode.git",
          "path": "packages/sdk/js/src/v2/gen/sdk.gen.ts",
          "line": 609,
          "symbol": "App.skills"
        }
      ]
    },
    {
      "id": "OC-SSE-0001",
      "category": "events",
      "operation": "event.subscribe",
      "transport": "sse",
      "method": "GET",
      "path": "/event",
      "support": "required",
      "eventTypes": [
        "server.connected",
        "session.created",
        "session.updated",
        "session.deleted",
        "message.updated",
        "message.removed",
        "message.part.delta",
        "message.part.updated",
        "permission.asked",
        "permission.replied",
        "question.asked",
        "question.replied",
        "question.rejected",
        "session.status",
        "session.error"
      ],
      "sources": [
        {
          "repository": "https://github.com/pingdotgg/t3code.git",
          "path": "apps/server/src/provider/Layers/OpenCodeAdapter.ts",
          "line": 2235,
          "symbol": "startEventPump"
        },
        {
          "repository": "https://github.com/anomalyco/opencode.git",
          "path": "packages/sdk/js/src/v2/gen/sdk.gen.ts",
          "line": 1410,
          "symbol": "Event.subscribe"
        }
      ]
    },
    {
      "id": "OC-HTTP-0005",
      "category": "session",
      "operation": "session.create",
      "transport": "http",
      "method": "POST",
      "path": "/session",
      "support": "required",
      "requestFields": ["title", "permission"],
      "sources": [
        {
          "repository": "https://github.com/pingdotgg/t3code.git",
          "path": "apps/server/src/provider/Layers/OpenCodeAdapter.ts",
          "line": 2406,
          "symbol": "startSession"
        },
        {
          "repository": "https://github.com/anomalyco/opencode.git",
          "path": "packages/sdk/js/src/v2/gen/sdk.gen.ts",
          "line": 3399,
          "symbol": "Session.create"
        }
      ]
    },
    {
      "id": "OC-HTTP-0006",
      "category": "session",
      "operation": "session.get",
      "transport": "http",
      "method": "GET",
      "path": "/session/{sessionID}",
      "support": "required",
      "sources": [
        {
          "repository": "https://github.com/pingdotgg/t3code.git",
          "path": "apps/server/src/provider/Layers/OpenCodeAdapter.ts",
          "line": 1489,
          "symbol": "isRelatedOpenCodeSession"
        },
        {
          "repository": "https://github.com/anomalyco/opencode.git",
          "path": "packages/sdk/js/src/v2/gen/sdk.gen.ts",
          "line": 3516,
          "symbol": "Session.get"
        }
      ]
    },
    {
      "id": "OC-HTTP-0007",
      "category": "session",
      "operation": "session.update",
      "transport": "http",
      "method": "PATCH",
      "path": "/session/{sessionID}",
      "support": "conditional",
      "requestFields": ["permission"],
      "sources": [
        {
          "repository": "https://github.com/pingdotgg/t3code.git",
          "path": "apps/server/src/provider/Layers/OpenCodeAdapter.ts",
          "line": 2365,
          "symbol": "startSession"
        },
        {
          "repository": "https://github.com/anomalyco/opencode.git",
          "path": "packages/sdk/js/src/v2/gen/sdk.gen.ts",
          "line": 3559,
          "symbol": "Session.update"
        }
      ]
    },
    {
      "id": "OC-HTTP-0008",
      "category": "session",
      "operation": "session.fork",
      "transport": "http",
      "method": "POST",
      "path": "/session/{sessionID}/fork",
      "support": "conditional",
      "requestFields": ["directory"],
      "sources": [
        {
          "repository": "https://github.com/pingdotgg/t3code.git",
          "path": "apps/server/src/provider/Layers/OpenCodeAdapter.ts",
          "line": 2382,
          "symbol": "startSession"
        },
        {
          "repository": "https://github.com/anomalyco/opencode.git",
          "path": "packages/sdk/js/src/v2/gen/sdk.gen.ts",
          "line": 3897,
          "symbol": "Session.fork"
        }
      ]
    },
    {
      "id": "OC-HTTP-0009",
      "category": "session",
      "operation": "session.messages",
      "transport": "http",
      "method": "GET",
      "path": "/session/{sessionID}/message",
      "support": "required",
      "sources": [
        {
          "repository": "https://github.com/pingdotgg/t3code.git",
          "path": "apps/server/src/provider/Layers/OpenCodeAdapter.ts",
          "line": 3074,
          "symbol": "readThread"
        },
        {
          "repository": "https://github.com/anomalyco/opencode.git",
          "path": "packages/sdk/js/src/v2/gen/sdk.gen.ts",
          "line": 3731,
          "symbol": "Session.messages"
        }
      ]
    },
    {
      "id": "OC-HTTP-0010",
      "category": "session",
      "operation": "session.message",
      "transport": "http",
      "method": "GET",
      "path": "/session/{sessionID}/message/{messageID}",
      "support": "conditional",
      "sources": [
        {
          "repository": "https://github.com/pingdotgg/t3code.git",
          "path": "apps/server/src/provider/Layers/OpenCodeAdapter.ts",
          "line": 1193,
          "symbol": "schedulePromptAdmissionRecovery"
        },
        {
          "repository": "https://github.com/anomalyco/opencode.git",
          "path": "packages/sdk/js/src/v2/gen/sdk.gen.ts",
          "line": 3829,
          "symbol": "Session.message"
        }
      ]
    },
    {
      "id": "OC-HTTP-0011",
      "category": "session",
      "operation": "session.status",
      "transport": "http",
      "method": "GET",
      "path": "/session/status",
      "support": "required",
      "sources": [
        {
          "repository": "https://github.com/pingdotgg/t3code.git",
          "path": "apps/server/src/provider/Layers/OpenCodeAdapter.ts",
          "line": 1027,
          "symbol": "scheduleIdleReconciliation"
        },
        {
          "repository": "https://github.com/anomalyco/opencode.git",
          "path": "packages/sdk/js/src/v2/gen/sdk.gen.ts",
          "line": 3484,
          "symbol": "Session.status"
        }
      ]
    },
    {
      "id": "OC-HTTP-0012",
      "category": "turn",
      "operation": "session.promptAsync",
      "transport": "http",
      "method": "POST",
      "path": "/session/{sessionID}/prompt_async",
      "support": "required",
      "requestFields": ["messageID", "model", "agent", "variant", "parts"],
      "sources": [
        {
          "repository": "https://github.com/pingdotgg/t3code.git",
          "path": "apps/server/src/provider/Layers/OpenCodeAdapter.ts",
          "line": 2687,